{
  "schema_version": "openforge-security-readiness-evidence/v1",
  "repository": "dasomel/clusterdeck",
  "revision": "2f25ed744a2feb59749606b78e416df2e1063ccf",
  "observed_at": "2026-10-15T11:45:29Z",
  "signals": [
    {
      "id": "scorecard",
      "source": {
        "tool": "openssf-scorecard",
        "version": "v5.6.0",
        "observed_at": "2026-10-15T11:45:29Z",
        "ref": "scorecard --repo=github.com/dasomel/clusterdeck --format=json (scanned commit 2f25ed744a2feb59749606b78e416df2e1063ccf; scorecard commit 61e8474; raw output: portfolio/security-readiness/scorecard/clusterdeck.json; checks digest sha256:f28c8e608a75cea4fb1f5d0f8537cc88955dd996158894e1ab27ceb5121aedee)"
      },
      "status": "partial",
      "note": "Scorecard v5.6.0 overall 3.6/10 over 18 checks (17 conclusive). Inconclusive (-1, never counted as pass): Packaging. Status follows the upstream score, not an OpenForge threshold: pass only at 10/10 with no check below 10, fail at 0, otherwise partial.",
      "findings": [
        {
          "id": "clusterdeck-scorecard-branch-protection",
          "summary": "Branch-Protection 0/10: branch protection not enabled on development/release branches",
          "severity": "high"
        },
        {
          "id": "clusterdeck-scorecard-cii-best-practices",
          "summary": "CII-Best-Practices 0/10: no effort to earn an OpenSSF best practices badge detected",
          "severity": "low"
        },
        {
          "id": "clusterdeck-scorecard-code-review",
          "summary": "Code-Review 0/10: Found 0/13 approved changesets -- score normalized to 0",
          "severity": "high"
        },
        {
          "id": "clusterdeck-scorecard-contributors",
          "summary": "Contributors 0/10: project has 0 contributing companies or organizations -- score normalized to 0",
          "severity": "low"
        },
        {
          "id": "clusterdeck-scorecard-fuzzing",
          "summary": "Fuzzing 0/10: project is not fuzzed",
          "severity": "medium"
        },
        {
          "id": "clusterdeck-scorecard-maintained",
          "summary": "Maintained 0/10: project was created within the last 90 days. Please review its contents carefully",
          "severity": "high"
        },
        {
          "id": "clusterdeck-scorecard-pinned-dependencies",
          "summary": "Pinned-Dependencies 6/10: dependency not pinned by hash detected -- score normalized to 6",
          "severity": "medium"
        },
        {
          "id": "clusterdeck-scorecard-sast",
          "summary": "SAST 0/10: SAST tool is not run on all commits -- score normalized to 0",
          "severity": "medium"
        },
        {
          "id": "clusterdeck-scorecard-security-policy",
          "summary": "Security-Policy 4/10: security policy file detected",
          "severity": "medium"
        },
        {
          "id": "clusterdeck-scorecard-signed-releases",
          "summary": "Signed-Releases 0/10: Project has not signed or included provenance with any releases.",
          "severity": "high"
        },
        {
          "id": "clusterdeck-scorecard-token-permissions",
          "summary": "Token-Permissions 0/10: detected GitHub workflow tokens with excessive permissions",
          "severity": "high"
        },
        {
          "id": "clusterdeck-scorecard-vulnerabilities",
          "summary": "Vulnerabilities 2/10: 8 existing vulnerabilities detected",
          "severity": "high"
        }
      ]
    },
    {
      "id": "security-policy",
      "status": "pass",
      "source": {
        "tool": "gh-api",
        "observed_at": "2026-10-07T04:28:29Z",
        "ref": "gh api repos/dasomel/clusterdeck/contents/SECURITY.md --jq .path -> SECURITY.md (revision 2f25ed7)"
      }
    },
    {
      "id": "actions-pinning",
      "status": "partial",
      "source": {
        "tool": "grep",
        "observed_at": "2026-10-07T04:28:29Z",
        "ref": "gh api repos/dasomel/clusterdeck/contents/.github/workflows (all files) | grep uses: lines, exclude ./ and @<40-hex>: 12 uses: lines, 5 not pinned to a 40-hex SHA"
      },
      "findings": [
        {
          "id": "clusterdeck-pin-1",
          "summary": "5 workflow action reference(s) not pinned to a full commit SHA: ci.yml:25,28,33,38,43 (actions/checkout@v7, pnpm/action-setup@v6, actions/setup-node@v7, dtolnay/rust-toolchain@stable, Swatinem/rust-cache@v2)",
          "severity": "medium"
        }
      ],
      "remediation": {
        "state": "not-started"
      }
    },
    {
      "id": "sbom",
      "status": "fail",
      "source": {
        "tool": "grep+gh-api",
        "observed_at": "2026-10-07T04:28:29Z",
        "ref": "grep -i 'sbom|syft|cyclonedx|spdx' .github/workflows/*.yml -> no match; gh api repos/dasomel/clusterdeck/releases/latest assets: ClusterDeck_0.4.1_aarch64.app.tar.gz, ClusterDeck_0.4.1_aarch64.dmg"
      },
      "findings": [
        {
          "id": "clusterdeck-sbom-1",
          "summary": "No SBOM generation in workflows and none among latest release (v0.4.1) assets",
          "severity": "medium"
        }
      ],
      "remediation": {
        "state": "not-started"
      }
    },
    {
      "id": "provenance",
      "status": "fail",
      "source": {
        "tool": "grep",
        "observed_at": "2026-10-07T04:28:29Z",
        "ref": "grep -i 'attest|slsa|id-token' .github/workflows/*.yml -> no match in workflows of dasomel/clusterdeck"
      },
      "findings": [
        {
          "id": "clusterdeck-prov-1",
          "summary": "No build provenance attestation (attest-build-provenance / slsa-github-generator) found in workflows",
          "severity": "medium"
        }
      ],
      "remediation": {
        "state": "not-started"
      }
    },
    {
      "id": "release-signing",
      "status": "fail",
      "source": {
        "tool": "grep+gh-api",
        "observed_at": "2026-10-07T04:28:29Z",
        "ref": "grep -i 'cosign|sigstore' .github/workflows/*.yml -> no match; latest release v0.4.1 assets (ClusterDeck_0.4.1_aarch64.app.tar.gz, ClusterDeck_0.4.1_aarch64.dmg) include no signature/certificate files"
      },
      "findings": [
        {
          "id": "clusterdeck-sign-1",
          "summary": "No release signing (cosign/sigstore) found in workflows or latest release assets",
          "severity": "medium"
        }
      ],
      "remediation": {
        "state": "not-started"
      }
    }
  ],
  "summary": {
    "total": 6,
    "pass": 1,
    "fail": 3,
    "partial": 2,
    "not_run": 0,
    "not_applicable": 0
  },
  "disclaimer": "Upstream tools remain the source of the underlying checks; OpenForge only normalizes the evidence. This record is not a compliance or certification claim."
}
